ac054f5c-d085-407b-bc18-bd852bf7a59c,1,140,fr,Comment allez-vous?
0126a287-6c3e-4df6-976e-a765077b804f,1,501,en,how to change account info
8bb71dc2-38a9-4dfe-9ade-04ebc8560fb6,1,501,en,how to change account information
f0faf9b3-3079-4b0a-99cc-82c88c98a37b,1,501,en,what is the process to change account info
153c39b4-e0f9-4486-bd92-b92ff1586f7c,1,504,en,how to change address in MILO
baff0fad-0b68-414b-87dd-56b19afd108e,1,504,en,how to change address & provides link in MILO
152a9e76-d46d-4326-b22e-9d672d8ff2d1,1,506,en,how to subscriber name change
13c966cb-fb6b-419c-8c44-ce6e57f43355,1,506,en,how to legal name change
3f66d5c5-155b-4416-a44b-e8b1427f21ff,1,506,en,how to TOWN  name change
599398e5-79a4-417a-9602-c9f559b04d8e,1,507,en,can I Subscriber name change
a9fb3fd9-0603-4782-b02f-302b5b9ac145,1,507,en,how to Subscriber name change
28e08370-8e67-451d-a29f-c6d23ee89bc4,1,508,en,how to change consumer TOWN name
ed85c802-b49d-4bc5-9088-5f3fd60ed419,1,508,en,can I change consumer TOWN name
dc945668-be32-4b5b-89b2-01cb590639ab,1,509,en,consumer to consumer town
f3407841-f36d-4ce3-a84b-b9a82b127552,1,509,en,consumer to consumer town
49606685-a5e3-419b-8d62-0af5b120554d,1,510,en,Bus or Corp
bf967d85-7857-4e07-80a8-6b42ba0d6368,1,510,en,Bus or Corp
971c6dc7-51f0-4837-9058-ef9d2af73577,1,511,en,BUSINESS
76f415ad-28e2-4dbc-bf88-4fd0047a9956,1,511,en,BUSINESS
ea71c859-8522-4a5b-a74f-7a7e59fa4ed3,1,512,en,Corporate
98f8be09-c131-4634-89c8-852ba32ae8a8,1,512,en,Corporate
9ba9f224-84d5-4773-9d17-336bcdc5b231,1,513,en,change phone number
dd303f29-e50b-4e96-b4f7-3b7e108f3bba,1,513,en,change phone number
e0506100-6aab-43e1-a8d3-955f64bf9d4a,1,514,en,Role Manager
25a1380a-e9b2-4f71-9f0f-441cde938694,1,514,en,Role Manager
8dec83b2-c725-47f1-bdb8-b9fb08aa59b7,1,515,en,Explain different roles
a72d096e-93a1-4d78-b358-bf64941c614f,1,515,en,Explain different roles
13b3e3f4-2c8a-42ac-9207-f2c0749873cc,1,516,en,continue to process change
89578f34-2b7f-450e-979b-a46643529b82,1,516,en,continue to process change
0305d9eb-b22f-45f4-b4ec-022d7d521fa5,1,498,en,how to link an account in Portal OneStop
9b315a66-6c55-4099-a9f1-a0be888f742f,1,498,en,step to link an account in Portal OneStop
6c038968-493d-49bf-9a4b-e4deda5d7e73,1,498,fr,comment lier un compte dans Portal OneStop
cad90f31-4ba4-4b9f-adef-6372e3c72ec5,1,498,fr,un compte dans Portal OneStop
0ae3dd94-5152-4e29-b7f5-1f61904c489c,1,498,en,Rahul's portal onestop
f686916c-dda7-49a8-bc76-feec94135485,1,498,fr,Rahul's french Onestop cont
19127a12-1532-4ee1-8ba3-35b270d44123,1,236,en,How are you ChatBot.
148c8067-29fd-4886-8179-58f05372d427,1,236,en,Question2
740a5b75-900a-4997-9600-480f67ffb499,1,236,en,How to Add a New Profile in Outlook
d5d7fd5f-9483-4f2e-accc-1368b80a9603,1,236,en,Change password
007899dc-4eac-4fe8-819d-4fb79f499829,1,236,en,rsnvprsvirvn0r
6d3449f2-93e1-43f2-9443-916f3ac75737,1,236,en,how to enroll for telus plans
5b32fa21-8adc-4d12-94c3-15d12ded78e8,1,236,en,Existe-t-il une option de paiement à la livraison?
6ead3010-6986-426f-9bed-309072ac59a6,1,236,en,asdadasdasd
8258d227-608c-4e5f-af8b-5b95e770d1aa,1,517,en,Can you explain me about the different type of bills
987cfc17-ef34-4b08-990b-6514d48d5a31,1,517,en,What is printed bill
a14a9432-d317-4016-9ffe-bf270c9240bb,1,517,en,What are unbilled charges
b680e4bc-3f21-4f92-9a45-6afc568f9525,1,518,en,Sections of my bill
3c7766db-5ee4-4ae1-9d34-a46c53315071,1,518,en,different sections in my bill
8b287f51-3578-4939-954f-c3b525beaeef,1,519,en,How to read my bill
a69ae854-0fbc-4164-821f-8c530a7ffee2,1,519,en,Steps to read my bill
7fd5f8dd-0351-4c33-b54c-732483a088a6,1,519,en,Information on reading my bill
e13238d2-2936-4292-885e-54665031cdda,1,520,en,What are the navigation available
56bed541-a7aa-4508-9117-4cd8bc86c177,1,520,en,Navigation options
daddfd43-0707-4d49-992d-b8e30eb462b9,1,521,en,lookup Bill terminology
ac82ede2-f7e1-4291-bfbc-3fa5a48552b9,1,521,en,Available Bill terminology
8738dc1f-3a43-4330-9bf1-38e57a9ecab5,1,521,en,Bill terminology explanation
35f52fa9-cfb6-4aba-9925-0fba3b382af2,1,522,en,Understand my bill
48d3db82-3329-499d-9c78-ade53cd0a335,1,522,en,How to read my bill
d47973bb-4cb6-45ee-beed-1dc977915525,1,523,en,What are Partial charges
af46d049-890e-4774-ae6c-7c7b53ce6c2b,1,523,en,What is Partial charge
df33c31c-1f16-43c7-8b90-67c647f9017c,1,523,en,Need information on partial charge
eccbf4d6-19a8-4c94-9ee8-78a585339ddf,1,524,en,Navigate to First Page
f5c9ad9d-31c3-4f3e-b965-ce76181268cc,1,524,en,First Page of the bill
4ca522b4-e3c5-4a06-9020-bced17d0bfda,1,525,en,What are the different charges
49931f02-98de-44ee-bebb-d63448907c0b,1,525,en,What are the payment methods available
28808a22-070d-47c2-a650-751c66039b8d,1,525,en,What are the different credits available
9aff870f-6117-4ae0-885d-fd9404d881da,1,526,en,I need my mobile services summary
6a715c17-8b3b-4a08-93a0-77646451c045,1,526,en,Need mobile service summary
d9e512c2-f669-4c53-b4a2-f63e9864c8a7,1,527,en,What are unbilled charges
660ee50d-f565-42cf-ac7b-646e98dbeb22,1,527,en,unbilled charges
e60274f7-5455-485b-a828-f16c35e84fb2,1,528,en,Individual line breakdown
d3d798a5-1441-4928-9736-cd17f6f255fe,1,528,en,My individual line breakdown
6b17bd95-a052-4113-851a-51ebe7a20b4d,1,541,en,assistance with My Account Admin Tool
1750e788-8d08-4dcb-96d7-19a48a63f475,1,541,en,can you assistance me for My Account Admin Tool
717a3604-203b-40aa-a9f1-b2b4f2963716,1,542,en,what changes do you need to make?
359e1283-0601-465e-92d0-e3b8c4bcd84f,1,542,en,which changes do you need to make?
1c0fb079-eac3-42af-88f0-b1528106f133,1,543,en,how to Reset Password account admin
16aa6e46-82ee-4bbf-a5da-67ca65bf86e6,1,543,en,how to Reset Password account admin tool
c9576f57-8395-4baf-a6ba-9f56cc560009,1,544,en,Did it work?
c6136a00-5aef-4d45-a159-fd358e238602,1,544,en,Did reset password work?
c00febe8-a0cf-433c-b2cd-44374081bea9,1,545,en,let's try some troubleshooting
432bbcbf-2c2c-4fc3-bcf8-200f443be7f4,1,545,en,let's try some troubleshooting for issue
f1e51ba2-b2a8-4e4d-9284-9750ef0b2f3e,1,546,en,Did troubleshooting work?
2a256706-207f-49f9-8d03-ff5d9df21cb4,1,546,en,Did it work?
83d40712-b3c8-4505-ba7c-f34f1753a66a,1,547,en,Any other questions?
22b592b2-1391-4c90-9d60-7186ac6c1647,1,547,en,Any other questions for issue
16716567-b50d-4982-af55-da3e56f5316a,1,344,en,How is the French language? Is it good?
60c3a657-e5f7-41f6-bc80-7b45f2d22224,1,344,en,What about the French language?
76b40c6c-a847-4eab-8bea-383639561b37,1,344,fr,Qu'en est-il de la langue française?
efeab56e-7cba-4a1b-a5f3-7506000facb4,1,344,fr,Comment est la langue française? Est-ce bien?
2e19fc2c-5875-4181-b3d1-7d7cc500b098,1,344,en,Is French first language? A good language?
91f53c09-e040-41f6-bfc3-d5ec25be6362,1,344,en,123456789
84b5e52f-8c61-4a37-8e55-dc6c09946fa9,1,344,en,installer gratuitement mon TELUS Android
fefe7134-7cf9-43aa-9775-ab94a44b13e4,1,533,en,Q2
61bbd06a-7c76-4acd-a649-ad8fe603443d,1,533,en,this chat is for assign
60643a89-ad5b-4f3e-bedd-22a4a8a8d7e8,1,533,en,Q1
fbf5112b-c7c4-4a76-9728-a325c5c916d3,1,533,en,asdadasdasd
e3a3d9f4-edc7-4db7-9941-f9a5fb2a2ad8,1,533,en,what is telus so
b6e36d9c-ca1f-47a1-be38-2c548897be20,1,533,en,madam
ec7ebff0-1ad0-48e7-b5c6-6b739c8c2812,1,533,en,jo
29814502-fa37-4cab-956f-74a43a3bb309,1,533,en,Situations that may result in order cancellation include:
16f3ee7a-bfe2-43be-b7a6-b37c7b3ca1c1,1,533,en,How do I cancel an order?
c817f096-e325-43ed-8d9c-2562741f8d34,1,533,en,Appels Wifi pour téléphone
d823361a-ab12-4f7e-9e37-4ebaeba19852,1,533,en,what is this
0507cc08-b748-4d28-b958-794890215db7,1,533,en,how are ypou
b9e89273-a37b-428d-ad9b-54b1a7a6d7ee,1,533,en,besoin d aide
2081e6b9-8fdf-422f-9fd3-aba417b014a3,1,533,en,kk
d6443b94-249d-43c7-9b57-367e2810884a,1,533,en,yes yeah
c8f59175-f623-44c7-a005-76d45af61fee,1,533,en,how to change sim
4955595a-8212-4709-9f01-8ce6708a9656,1,533,en,kjhfsjkhfkjsdhkjfhsdkjfhskjd
f78c4237-2c91-4d3a-8cfa-0e2d4e25fc91,1,533,en,dfdrsg
4f0e3296-cdb7-4831-956b-2df1b32758aa,1,533,en,fdd
2fd3caea-4df7-485e-94bf-1765635f0c7e,1,533,en,please help me
5370cf4c-2ac8-4b93-9fb7-c8164b1fba02,1,598,en,Image wrap issue
691e51f9-903f-4d07-b325-daaebc5ad2fc,1,598,en,URL wrap issue
b2afe06f-81aa-4527-b7fc-5983b0c442c5,1,302,en,How is the French language? Is it good?
a3fdbf42-5ebb-4244-bfd8-efb919ef6fe4,1,302,en,What about the French language?
b78f82fd-9da9-4801-a106-80172a977fa4,1,302,fr,Qu'en est-il de la langue française?
4457d76f-ce2e-4d18-a3b7-a5797293c591,1,302,fr,Comment est la langue française? Est-ce bien?
06fd4523-09b3-4727-b49c-aeba66045017,1,302,en,Is French first language? A good language?
3af7f742-5bca-47ec-bd51-93190b9d81a5,1,302,en,Quick reply with query
59df6c78-13ad-462d-a421-8ef151318d82,1,302,en,french
afb5dda2-f752-4597-bb6a-ca228a6e32d1,1,302,en,anglo
c72c5981-5690-4c1a-a53f-2369f3a0f195,1,302,en,french
11e91d6d-06b2-49cf-9e70-0147e9615680,1,302,en,pourquoi le texte / l icône d appel téléphonique wifi de telus a t il cessé de s afficher à l écran?
43976bea-c711-41f6-850b-1a1b3bfc3695,1,352,en,"If Telus delivers to a pin code close to my place ,can I place my order?"
c67dfa5f-8b82-49f5-aea2-d53ed7e86186,1,352,en,Is there any option for one day delivery?
108ef6ea-9ca8-46c9-9386-2d82e9362f0f,1,352,en,good
f345b9dd-3b9f-4ae4-b91d-a9ca956f1052,1,352,en,how does yelus work?
